[
  {
    "id": "REV_01",
    "category": "revenue",
    "name": "output sku packagable",
    "rule": "todo output debe ser empaquetable como SKU vendible",
    "check": "output.sku_ready == true",
    "action": "reject",
    "severity": "critical",
    "weight": 0.10,
    "enabled": true,
    "phase": "post",
    "description": "Si no es vendible como SKU, no pasa"
  },
  {
    "id": "REV_02",
    "category": "revenue",
    "name": "impacto medible definido",
    "rule": "toda solución debe tener métricas de impacto",
    "check": "output.metrics != null && output.metrics.defined == true",
    "action": "warn",
    "severity": "high",
    "weight": 0.08,
    "enabled": true,
    "phase": "post",
    "description": "Sin métricas no hay forma de probar valor"
  },
  {
    "id": "REV_03",
    "category": "revenue",
    "name": "modelo de precio definido",
    "rule": "todo SKU debe tener modelo de precio",
    "check": "output.sku != null && output.sku.price_model != null",
    "action": "reject",
    "severity": "critical",
    "weight": 0.08,
    "enabled": true,
    "phase": "post",
    "description": "Setup + mensual o precio único"
  },
  {
    "id": "REV_04",
    "category": "revenue",
    "name": "revenue potential > 0",
    "rule": "el output debe tener potencial de revenue",
    "check": "output.revenue_potential > 0",
    "action": "warn",
    "severity": "medium",
    "weight": 0.07,
    "enabled": true,
    "phase": "post",
    "description": "Si no genera revenue, por qué hacerlo"
  },
  {
    "id": "REV_05",
    "category": "revenue",
    "name": "lead scoring integrado",
    "rule": "si hay lead → debe incluir scoring",
    "check": "intent.lead != null → output.score != null",
    "action": "force_delegation",
    "severity": "high",
    "weight": 0.07,
    "enabled": true,
    "phase": "post",
    "description": "Delegar a revenue engine para scoring"
  },
  {
    "id": "REV_06",
    "category": "revenue",
    "name": "oportunidad Odoo creada",
    "rule": "si score > 85 → crear oportunidad en Odoo",
    "check": "output.score > 0.85 → output.odoo_opportunity_created == true",
    "action": "force_delegation",
    "severity": "high",
    "weight": 0.07,
    "enabled": true,
    "phase": "post",
    "description": "Delegar a Odoo agent para crear oportunidad"
  },
  {
    "id": "REV_07",
    "category": "revenue",
    "name": "time-to-value estimado",
    "rule": "debe incluir tiempo estimado de entrega",
    "check": "output.time_to_deploy != null",
    "action": "warn",
    "severity": "medium",
    "weight": 0.05,
    "enabled": true,
    "phase": "post",
    "description": "El cliente necesita saber cuándo tendrá valor"
  },
  {
    "id": "REV_08",
    "category": "revenue",
    "name": "ROI estimado incluido",
    "rule": "debe incluir ROI estimado del proyecto",
    "check": "output.roi_estimate != null",
    "action": "warn",
    "severity": "medium",
    "weight": 0.05,
    "enabled": true,
    "phase": "post",
    "description": "ROI = (beneficio - costo) / costo"
  },
  {
    "id": "REV_09",
    "category": "revenue",
    "name": "alerta Telegram si HOT lead",
    "rule": "si lead score >= 85 → alertar por Telegram",
    "check": "intent.lead_score >= 85 → output.telegram_alert_sent == true",
    "action": "force_delegation",
    "severity": "high",
    "weight": 0.07,
    "enabled": true,
    "phase": "post",
    "description": "Delegar a Telegram agent para alerta inmediata"
  },
  {
    "id": "REV_10",
    "category": "revenue",
    "name": "auto-invoice si convertido",
    "rule": "si lead convertido → crear factura Odoo",
    "check": "lead.status == 'converted' → invoice_created == true",
    "action": "force_delegation",
    "severity": "high",
    "weight": 0.07,
    "enabled": true,
    "phase": "post",
    "description": "Delegar a auto-invoice agent"
  }
]
