[
  {
    "id": "RISK_01",
    "category": "risk",
    "name": "no ejecutar sin validaci\u00f3n si impacto alto",
    "rule": "si impacto es alto \u2192 requiere validaci\u00f3n humana",
    "check": "impact.level == 'high' \u2192 human_validated == true",
    "action": "require_confirmation",
    "severity": "critical",
    "weight": 0.1,
    "enabled": true,
    "phase": "pre",
    "description": "Decisiones de alto impacto necesitan humano"
  },
  {
    "id": "RISK_02",
    "category": "risk",
    "name": "no credentials en output",
    "rule": "nunca incluir credenciales en output al usuario",
    "check": "contains_credentials == false",
    "action": "reject",
    "severity": "critical",
    "weight": 0.1,
    "enabled": true,
    "phase": "post",
    "description": "Fuga de credenciales = incidente de seguridad"
  },
  {
    "id": "RISK_03",
    "category": "risk",
    "name": "rate limiting respetado",
    "rule": "no exceder rate limits de APIs externas",
    "check": "api.calls_per_minute < api.rate_limit",
    "action": "reject",
    "severity": "high",
    "weight": 0.063,
    "enabled": true,
    "phase": "pre",
    "description": "Rate limit exceeded = API bloqueada"
  },
  {
    "id": "RISK_04",
    "category": "risk",
    "name": "data backup antes de cambios",
    "rule": "antes de cambios estructurales \u2192 backup",
    "check": "change.structural == true \u2192 backup.created == true",
    "action": "require_confirmation",
    "severity": "high",
    "weight": 0.07,
    "enabled": true,
    "phase": "pre",
    "description": "Sin backup, no hay recovery"
  },
  {
    "id": "RISK_05",
    "category": "risk",
    "name": "no single point of failure",
    "rule": "sistema cr\u00edtico no debe depender de 1 componente",
    "check": "system.has_redundancy == true || system.is_non_critical == true",
    "action": "flag_for_review",
    "severity": "high",
    "weight": 0.063,
    "enabled": true,
    "phase": "post",
    "description": "SPOF = outage garantizado"
  },
  {
    "id": "RISK_06",
    "category": "risk",
    "name": "PII protegida",
    "rule": "datos personales deben estar encriptados",
    "check": "data.contains_pii == false || data.pii_encrypted == true",
    "action": "reject",
    "severity": "critical",
    "weight": 0.1,
    "enabled": true,
    "phase": "post",
    "description": "Ley de protecci\u00f3n de datos: PII siempre encriptada"
  },
  {
    "id": "RISK_07",
    "category": "risk",
    "name": "audit trail completo",
    "rule": "toda acci\u00f3n debe dejar rastro de auditor\u00eda",
    "check": "action.audit_logged == true",
    "action": "reject",
    "severity": "high",
    "weight": 0.063,
    "enabled": true,
    "phase": "post",
    "description": "Sin audit trail, no hay compliance"
  },
  {
    "id": "RISK_08",
    "category": "risk",
    "name": "costo no excede presupuesto",
    "rule": "costo estimado no debe exceder presupuesto del proyecto",
    "check": "cost.estimated <= budget.allocated",
    "action": "require_confirmation",
    "severity": "high",
    "weight": 0.063,
    "enabled": true,
    "phase": "pre",
    "description": "Over budget = proyecto cancelado"
  },
  {
    "id": "RISK_09",
    "category": "risk",
    "name": "compliance legal verificado",
    "rule": "soluci\u00f3n debe cumplir regulaciones locales",
    "check": "compliance.legal_checked == true",
    "action": "flag_for_review",
    "severity": "high",
    "weight": 0.07,
    "enabled": true,
    "phase": "post",
    "description": "SII, protecci\u00f3n de datos, etc."
  },
  {
    "id": "RISK_10",
    "category": "risk",
    "name": "fallback definido",
    "rule": "si el sistema falla \u2192 debe existir fallback",
    "check": "system.fallback_defined == true",
    "action": "warn",
    "severity": "medium",
    "weight": 0.05,
    "enabled": true,
    "phase": "post",
    "description": "Plan B cuando el Plan A explota"
  }
]